{
  "schemaVersion": 2,
  "mode": "fresh",
  "network": "preprod",
  "provider": "blockfrost",
  "tld": "andamio",
  "sld": "api",
  "runId": "20260717-194353",
  "confirmed": {
    "mintSld": {
      "txId": "69117c8cd1c6bd46ac04f0aba40555c121d29e5e796786e5d1e81fe8bce89363",
      "manifest": "E:\\Computer Eng\\Projects\\Handshake\\dns-cli\\demo\\runs\\andamio\\api\\20260717-194353\\artifacts\\04-mint-sld.manifest.json"
    },
    "updateSld": {
      "txId": "7253ae87d77441e9953f7b609897f6cd6fd3fbbef13e98b0b391a736a7fcb3d5",
      "manifest": "E:\\Computer Eng\\Projects\\Handshake\\dns-cli\\demo\\runs\\andamio\\api\\20260717-194353\\artifacts\\05-update-sld.manifest.json"
    }
  }
}
